JOUR ,,,,,"The pesticides endosulfan and amitraz were fed to 2 groups of Nubian goats (3 goats/group) at 5 mg/kg/d for 36 d to assess their effects on feedlot performance, carcass yield and meat quality. Growth rates, weight gains and feed conversion efficiencies were depressed insignificantly. The endosulfan-dosed group had significantly lower dressing-out percentage and both groups had significant depletions of omental and mesenteric fats. Significant reductions were also seen on body and cavity fats, the latter being severely reduced suggesting more mobilization of cavity fat than body fat. The fat-free body was homogenous with variations in the muscle/bone ratio reflected on carcass cuts. Meat quality was unaffected. Fat was the only chemical component of endosulfan-dosed total lean significantly reduced. In all parameters the effects of endosulfan were more pronounced than those of amitraz. ",,,"Abdalla, G. A. ",,,,,,,,,,,,,,,,Apr ,,,,,,,28751,2,,,,,,"Administration, Oral Animals Body Composition/drug effects Body Weight/drug effects Endosulfan/adverse effects Goats Insecticides/adverse effects Meat/analysis Organ Size/drug effects Time Factors Toluidines/adverse effects ",,,,,,,,,,,"Amin, A E Abdalla, G A eng 1995/04/01 Vet Hum Toxicol. 1995 Apr;37(2):113-6. ",,,,,,1995,,,,,,113-6 ,"Effects of endosulfan and amitraz on feedlot performance, carcass yield and meat quality characteristics of Nubian goats ",,Vet Hum Toxicol ,,,"Effects of endosulfan and amitraz on feedlot performance, carcass yield and meat quality characteristics of Nubian goats ",,,,,,,,37,,,,  
JOUR ,,,,,"Molasses at 10, 30 or 50% of the diet for 12 w was not toxic to goats and could be used as an inexpensive substitute for sorghum grain. No animals showed signs or lesions of illness attributable to feeding molasses. There were no differences among treatment groups in any of the following parameters: WBC, RBC, PCV, Hb, MCV, MCHC, GOT, uric acid, urea, cholesterol, and zinc. Serum creatinine, total protein, iron, copper, magnesium and calcium varied between groups but remained within the ranges for normal goats. Feedlot performance indicated that utilization of molasses energy for body weight gain was a function of intake; feeding 50% dietary molasses did not produce economic weight gain. ",,,"Adam, S. E. ",,,,,,,,,,,,,,,,Jun ,,,,,,01/06/1993,28752,3,,Veterinary and human toxicology ,,,, Cerebral Cortex/pathology Diet  Goats Iron/blood  Molasses/toxicity Necrosis ,,,,,,,,,,,,,,,,,1993,,,,,,213-6 ,Determination of the toxicity of molasses in Nubian goats ,,Vet Hum Toxicol ,,,Determination of the toxicity of molasses in Nubian goats ,,,,,,,,35,,,,  
JOUR ,,,,,,,,"al, et ",,,,,,,,,,,,,,,,1962,,,,,,,28754,1,,,,,,Gaucher's Disease ,,,,,,,,,,,,,,,,,1962,,,,,,1,A case of gaucher's disease ,,Sudan Medical Journal ,,,A case of gaucher's disease ,,,,,,,,34,,,,  
JOUR ,,,,,,,,"al, et ",,,,,,,,,,,,,,,,1970,,,,,,,28755,,,,,,,Immunoelectrophoresis Haemochromatosis ,,,,,,,,,,,,,,,,,1970,,,,,,613,Studies by immunoelectrophoresis on non binding proteins in haemochromatosis ,,CI. Sc ,,,Studies by immunoelectrophoresis on non binding proteins in haemochromatosis ,,,,,,,,38,,,,  
JOUR ,,,,,"This study was carried out in southern Darfur, Sudan during dry-and green (wet) season and was designed to investigate the effects of season (dry-versus green season) on the blood constituents of the one-humped camel (Camelus dromedarius). Two hundred and ten blood samples collected from apparently healthy one-humped camels (Camelus dromedarius) of different age and sex groups were used in this study, out of which 110 blood samples were collected during the dry season, while 100 blood samples were collected during the green season. The data analysis revealed that the season had significant effects on some of the haematological indices and the blood metabolites and minerals concentrations. The red blood cells count, lymphocytes and basophils percentages increased significantly during the dry season, while the osmotic resistance, MCV, MCH and neutrophils percentage increased significantly during the green season. The serum levels of total protein, globulins and triglycerides increased significantly during the dry season, while the concentrations of plasma glucose and serum urea, creatinine, phosphorus (P) and calcium (Ca) increased significantly during the green season. The results obtained in the present study indicate that the nutritional status could induce significant changes in the physiological responses of the dromedary camel. The available forage during the green season improved the body condition, the blood metabolic and mineral profile in camels. The results indicate that despite camel's selectivity and unique adaptation to arid conditions; glucose, urea, P and Ca levels were lower during the dry season. Therefore, it could be beneficial to provide concentrate feed to camels kept under dry tropical conditions. ",,,"Abdelatif, A. M. ",,,,,,,,,,,,,,,,Apr-15,,,,,,,28756,8,,,,,,Aging/physiology Animals Blood Chemical Analysis Blood Proteins/analysis Camelus/blood/growth & development Climate Creatinine/blood Erythrocyte Count Female Hemoglobins/analysis Male Seasons Serum Albumin/analysis Serum Globulins/analysis Sudan Temperature Triglycerides/blood Urea/blood ,,,,,,,,,,,"Amin, Alia S A Abdoun, Khalid A Abdelatif, Abdalla M eng Research Support, Non-U.S. Gov't Pakistan 2007/04/15 00:00 Pak J Biol Sci. 2007 Apr 15;10(8):1250-6. ",,,,,,2007,,,,,,1250-6 ,Seasonal variation in blood constituents of one-humped camel (Camelus dromedarius) ,,Pak J Biol Sci ,,,Seasonal variation in blood constituents of one-humped camel (Camelus dromedarius) ,,,,,,,,10,,,,  
JOUR ,,,,,"The present study has been conducted in order to investigate the seasonal variation in the botanical and chemical composition of plant parts consumed by camels (Camelus dromedarius). The study has been conducted on 210 indigenous Arabian camel of different age (1-18 years) and sex and kept under natural range in southern Darfur, Sudan. The findings of the present study indicate that camels are selective browser rather than grazer. Furthermore, they are selective feeder to the parts of pasture plants they consume. The percentages of Crude Protein (CP), Crude Fibre (CF) and Nitrogen Free Extract (NFE) of pasture plants selected by camels were significantly higher, while ash percentage was significantly lower during the dry season. ",,,"Abdelatif, A. M. ",,,,,,,,,,,,,,,,Mar-15,,,,,,,28757,6,,,,,,Animals Camelus/physiology Diet Dietary Fiber/analysis Dietary Proteins/analysis Feeding Behavior/physiology Nitrogen/analysis Plants Seasons Sudan ,,,,,,,,,,,"Amin, Alia S A Abdoun, Khalid A Abdelatif, Abdalla M eng Comparative Study Research Support, Non-U.S. Gov't Pakistan 2007/03/15 00:00 Pak J Biol Sci. 2007 Mar 15;10(6):932-5. ",,,,,,2007,,,,,,932-5 ,Seasonal variation in botanical and chemical composition of plants selected by one-humped camel (Camelus dromedarius) ,,Pak J Biol Sci ,,,Seasonal variation in botanical and chemical composition of plants selected by one-humped camel (Camelus dromedarius) ,,,,,,,,10,,,,  
CHAP ,,"Kobusiewicz, M. ",,,"What material evidence there is indicates the social development in the central and southern Gezira Plain long proceeded along different lines to societies in and around the area and to the north of Khartoum (Brass, Brass and Schwenniger 2013, Edwards 1996, Fernandez et al. 2003, Sadig 2013, Salvatori 2012). The archaeology to the west and further south is less well known and the establishment of a firmer chronological and social framework for Jebel Moya would assist in anchoring future studies in the region. As the largest known cemetery locality in the region, the site provides extraordinary scope for exploring the interplay and interaction of indigenous and external cultural traditions. As such, my continuing doctoral research is into the presence of rich burials and detecting potential burial clusters, and how they may relate to indicators of institutionalised hierarchy or transient elites, while the pottery from both burial and non-burial contexts (Brass and Schwenniger 2013) may be indicative of a permissive form of social mobility and one in which a kin group's standing might be stated or enhanced through rites and social practices creating social legitimacy (Fleisher and Wynne-Jones 2010, Kohring and Wynne-Jones 2007). While there is no indication that any of the graves were of secondary use, there are instances of burials undercutting, cross-cutting or pushed up against other burials; these may be social members wanting to associate themselves for a variety of reasons (family, status association, etc). The variety and frequency of bodily orientations are not reflective of different temporal periods (contra Gerharz 1994) and may not necessarily be reflective of different groups per say burying their dead at the same locality, but rather it may be due to variable cultural traditions within a particular area. ",,,"Brass, M. ",,,,,,,,,,,,,,,Poznań (PL) ,,,,,,,,19393,,,,,,,,,,,,eng ,,,,,,"Chlodnicki, Marek Kabacinski, Jacek Kobusiewicz, Michal Brass, Michael 090865/Wellcome Trust/United Kingdom Review Book Chapter ",,,,,,2015,,,,,9.78836E+12,,"Mortuary Theory, Pottery and Social Complexity at Jebel Moya Cemetery, South-Central Sudan ",,Hunter-gatherers and Early Food Producing Societies in Northeastern Africa ,Wellcome Trust–Funded Monographs and Book Chapters ,,"Mortuary Theory, Pottery and Social Complexity at Jebel Moya Cemetery, South-Central Sudan ",,,,,,,https://www.ncbi.nlm.nih.gov/pubmed/27359026 ,,,,,  
CHAP ,,"Kobusiewicz, M. ",,,"What material evidence there is indicates the social development in the central and southern Gezira Plain long proceeded along different lines to societies in and around the area and to the north of Khartoum (Brass, Brass and Schwenniger 2013, Edwards 1996, Fernandez et al. 2003, Sadig 2013, Salvatori 2012). The archaeology to the west and further south is less well known and the establishment of a firmer chronological and social framework for Jebel Moya would assist in anchoring future studies in the region. As the largest known cemetery locality in the region, the site provides extraordinary scope for exploring the interplay and interaction of indigenous and external cultural traditions. As such, my continuing doctoral research is into the presence of rich burials and detecting potential burial clusters, and how they may relate to indicators of institutionalised hierarchy or transient elites, while the pottery from both burial and non-burial contexts (Brass and Schwenniger 2013) may be indicative of a permissive form of social mobility and one in which a kin group's standing might be stated or enhanced through rites and social practices creating social legitimacy (Fleisher and Wynne-Jones 2010, Kohring and Wynne-Jones 2007). While there is no indication that any of the graves were of secondary use, there are instances of burials undercutting, cross-cutting or pushed up against other burials; these may be social members wanting to associate themselves for a variety of reasons (family, status association, etc). The variety and frequency of bodily orientations are not reflective of different temporal periods (contra Gerharz 1994) and may not necessarily be reflective of different groups per say burying their dead at the same locality, but rather it may be due to variable cultural traditions within a particular area. ",,,"Brass, M. ",,,,,,,,,,,,,,,Poznań (PL) ,,,,,,,,19393,,,,,,,,,,,,eng ,,,,,,"Chlodnicki, Marek Kabacinski, Jacek Kobusiewicz, Michal Brass, Michael 090865/Wellcome Trust/United Kingdom Review Book Chapter ",,,,,,2015,,,,,9.78836E+12,,"Mortuary Theory, Pottery and Social Complexity at Jebel Moya Cemetery, South-Central Sudan ",,Hunter-gatherers and Early Food Producing Societies in Northeastern Africa ,Wellcome Trust–Funded Monographs and Book Chapters ,,"Mortuary Theory, Pottery and Social Complexity at Jebel Moya Cemetery, South-Central Sudan ",,,,,,,https://www.ncbi.nlm.nih.gov/pubmed/27359026 ,,,,,  
CHAP ,,"Baron, S. ",,,"Filoviruses were first discovered in 1967 as the causative agents of a hemorrhagic fever outbreak among laboratory workers in Europe. These workers had been exposed to tissues and blood from African green monkeys (Cercopithecus aethiops) imported from Uganda and infected with Marburg virus. Since then, sporadic cases of Marburg hemorrhagic fever in man have occurred in Kenya and Zimbabwe (Table 72-1). Ebola hemorrhagic fever was first reported from northern Zaire and southern Sudan in 1976 when two distinct subtypes were isolated during simultaneous epidemics. Ebola Sudan reemerged in 1979 at the same location, causing a smaller epidemic of viral hemorrhagic fever. The third subtype (Reston) was isolated from cynomolgus monkeys (Macaca fascicularis) imported from the Philippines into the United States in 1989 and into Italy in 1992. Another distinct Ebola virus emerged on the Ivory Coast in 1994. The virus was isolated from a nonfatal case, in which a worker was infected during the autopsy of a wild chimpanzee. Recently Ebola reemerged in southwestern Zaire in the city of Kikwit and the surrounding villages in Bandundu Province. The isolated virus was closely related to the 1976 Zairian isolate, and the outbreak in these regions resembled the previous Ebola hemorrhagic fever epidemics (Table 72-1). ",,,"Klenk, H. D. ",,,,,,,,,,,,,,,Galveston (TX) ,,,,,,,4th ,20893,,,,,,,,,,,,eng ,,,,,,"Baron, Samuel Feldmann, Heinz Klenk, Hans-Dieter Review Book Chapter ",,,,,,1996,,,,,963117211,,Filoviruses ,,Medical Microbiology ,,,Filoviruses ,,,,,,,https://www.ncbi.nlm.nih.gov/pubmed/21413301 ,,,,,  
CHAP ,,"Kobusiewicz, M. ",,,"What material evidence there is indicates the social development in the central and southern Gezira Plain long proceeded along different lines to societies in and around the area and to the north of Khartoum (Brass, Brass and Schwenniger 2013, Edwards 1996, Fernandez et al. 2003, Sadig 2013, Salvatori 2012). The archaeology to the west and further south is less well known and the establishment of a firmer chronological and social framework for Jebel Moya would assist in anchoring future studies in the region. As the largest known cemetery locality in the region, the site provides extraordinary scope for exploring the interplay and interaction of indigenous and external cultural traditions. As such, my continuing doctoral research is into the presence of rich burials and detecting potential burial clusters, and how they may relate to indicators of institutionalised hierarchy or transient elites, while the pottery from both burial and non-burial contexts (Brass and Schwenniger 2013) may be indicative of a permissive form of social mobility and one in which a kin group's standing might be stated or enhanced through rites and social practices creating social legitimacy (Fleisher and Wynne-Jones 2010, Kohring and Wynne-Jones 2007). While there is no indication that any of the graves were of secondary use, there are instances of burials undercutting, cross-cutting or pushed up against other burials; these may be social members wanting to associate themselves for a variety of reasons (family, status association, etc). The variety and frequency of bodily orientations are not reflective of different temporal periods (contra Gerharz 1994) and may not necessarily be reflective of different groups per say burying their dead at the same locality, but rather it may be due to variable cultural traditions within a particular area. ",,,"Brass, M. ",,,,,,,,,,,,,,,Poznań (PL) ,,,,,,,,19393,,,,,,,,,,,,eng ,,,,,,"Chlodnicki, Marek Kabacinski, Jacek Kobusiewicz, Michal Brass, Michael 090865/Wellcome Trust/United Kingdom Review Book Chapter ",,,,,,2015,,,,,9.78836E+12,,"Mortuary Theory, Pottery and Social Complexity at Jebel Moya Cemetery, South-Central Sudan ",,Hunter-gatherers and Early Food Producing Societies in Northeastern Africa ,Wellcome Trust–Funded Monographs and Book Chapters ,,"Mortuary Theory, Pottery and Social Complexity at Jebel Moya Cemetery, South-Central Sudan ",,,,,,,https://www.ncbi.nlm.nih.gov/pubmed/27359026 ,,,,,  
CHAP ,,"Baron, S. ",,,"Filoviruses were first discovered in 1967 as the causative agents of a hemorrhagic fever outbreak among laboratory workers in Europe. These workers had been exposed to tissues and blood from African green monkeys (Cercopithecus aethiops) imported from Uganda and infected with Marburg virus. Since then, sporadic cases of Marburg hemorrhagic fever in man have occurred in Kenya and Zimbabwe (Table 72-1). Ebola hemorrhagic fever was first reported from northern Zaire and southern Sudan in 1976 when two distinct subtypes were isolated during simultaneous epidemics. Ebola Sudan reemerged in 1979 at the same location, causing a smaller epidemic of viral hemorrhagic fever. The third subtype (Reston) was isolated from cynomolgus monkeys (Macaca fascicularis) imported from the Philippines into the United States in 1989 and into Italy in 1992. Another distinct Ebola virus emerged on the Ivory Coast in 1994. The virus was isolated from a nonfatal case, in which a worker was infected during the autopsy of a wild chimpanzee. Recently Ebola reemerged in southwestern Zaire in the city of Kikwit and the surrounding villages in Bandundu Province. The isolated virus was closely related to the 1976 Zairian isolate, and the outbreak in these regions resembled the previous Ebola hemorrhagic fever epidemics (Table 72-1). ",,,"Klenk, H. D. ",,,,,,,,,,,,,,,Galveston (TX) ,,,,,,,4th ,20893,,,,,,,,,,,,eng ,,,,,,"Baron, Samuel Feldmann, Heinz Klenk, Hans-Dieter Review Book Chapter ",,,,,,1996,,,,,963117211,,Filoviruses ,,Medical Microbiology ,,,Filoviruses ,,,,,,,https://www.ncbi.nlm.nih.gov/pubmed/21413301 ,,,,,  
CHAP ,,"Kobusiewicz, M. ",,,"What material evidence there is indicates the social development in the central and southern Gezira Plain long proceeded along different lines to societies in and around the area and to the north of Khartoum (Brass, Brass and Schwenniger 2013, Edwards 1996, Fernandez et al. 2003, Sadig 2013, Salvatori 2012). The archaeology to the west and further south is less well known and the establishment of a firmer chronological and social framework for Jebel Moya would assist in anchoring future studies in the region. As the largest known cemetery locality in the region, the site provides extraordinary scope for exploring the interplay and interaction of indigenous and external cultural traditions. As such, my continuing doctoral research is into the presence of rich burials and detecting potential burial clusters, and how they may relate to indicators of institutionalised hierarchy or transient elites, while the pottery from both burial and non-burial contexts (Brass and Schwenniger 2013) may be indicative of a permissive form of social mobility and one in which a kin group's standing might be stated or enhanced through rites and social practices creating social legitimacy (Fleisher and Wynne-Jones 2010, Kohring and Wynne-Jones 2007). While there is no indication that any of the graves were of secondary use, there are instances of burials undercutting, cross-cutting or pushed up against other burials; these may be social members wanting to associate themselves for a variety of reasons (family, status association, etc). The variety and frequency of bodily orientations are not reflective of different temporal periods (contra Gerharz 1994) and may not necessarily be reflective of different groups per say burying their dead at the same locality, but rather it may be due to variable cultural traditions within a particular area. ",,,"Brass, M. ",,,,,,,,,,,,,,,Poznań (PL) ,,,,,,,,19393,,,,,,,,,,,,eng ,,,,,,"Chlodnicki, Marek Kabacinski, Jacek Kobusiewicz, Michal Brass, Michael 090865/Wellcome Trust/United Kingdom Review Book Chapter ",,,,,,2015,,,,,9.78836E+12,,"Mortuary Theory, Pottery and Social Complexity at Jebel Moya Cemetery, South-Central Sudan ",,Hunter-gatherers and Early Food Producing Societies in Northeastern Africa ,Wellcome Trust–Funded Monographs and Book Chapters ,,"Mortuary Theory, Pottery and Social Complexity at Jebel Moya Cemetery, South-Central Sudan ",,,,,,,https://www.ncbi.nlm.nih.gov/pubmed/27359026 ,,,,,  
CHAP ,,"Kobusiewicz, M. ",,,"What material evidence there is indicates the social development in the central and southern Gezira Plain long proceeded along different lines to societies in and around the area and to the north of Khartoum (Brass, Brass and Schwenniger 2013, Edwards 1996, Fernandez et al. 2003, Sadig 2013, Salvatori 2012). The archaeology to the west and further south is less well known and the establishment of a firmer chronological and social framework for Jebel Moya would assist in anchoring future studies in the region. As the largest known cemetery locality in the region, the site provides extraordinary scope for exploring the interplay and interaction of indigenous and external cultural traditions. As such, my continuing doctoral research is into the presence of rich burials and detecting potential burial clusters, and how they may relate to indicators of institutionalised hierarchy or transient elites, while the pottery from both burial and non-burial contexts (Brass and Schwenniger 2013) may be indicative of a permissive form of social mobility and one in which a kin group's standing might be stated or enhanced through rites and social practices creating social legitimacy (Fleisher and Wynne-Jones 2010, Kohring and Wynne-Jones 2007). While there is no indication that any of the graves were of secondary use, there are instances of burials undercutting, cross-cutting or pushed up against other burials; these may be social members wanting to associate themselves for a variety of reasons (family, status association, etc). The variety and frequency of bodily orientations are not reflective of different temporal periods (contra Gerharz 1994) and may not necessarily be reflective of different groups per say burying their dead at the same locality, but rather it may be due to variable cultural traditions within a particular area. ",,,"Brass, M. ",,,,,,,,,,,,,,,Poznań (PL) ,,,,,,,,19393,,,,,,,,,,,,eng ,,,,,,"Chlodnicki, Marek Kabacinski, Jacek Kobusiewicz, Michal Brass, Michael 090865/Wellcome Trust/United Kingdom Review Book Chapter ",,,,,,2015,,,,,9.78836E+12,,"Mortuary Theory, Pottery and Social Complexity at Jebel Moya Cemetery, South-Central Sudan ",,Hunter-gatherers and Early Food Producing Societies in Northeastern Africa ,Wellcome Trust–Funded Monographs and Book Chapters ,,"Mortuary Theory, Pottery and Social Complexity at Jebel Moya Cemetery, South-Central Sudan ",,,,,,,https://www.ncbi.nlm.nih.gov/pubmed/27359026 ,,,,,  
JOUR ,,,,,,,,"Bray, H. A. ",,,,,,,,,,,,,,,,1904,,,,,,,597,,,,,,,Chicken Pox Pox Disease ,,,,,,,,,,,,,,,,,1904,,,,,,,Chicken Pox ,,J Roy Army Med Corps ,,,Chicken Pox ,,,,,,,,October ,,,,  
JOUR ,,,,,"Adult immunocompetent mice inoculated with Ebola (EBO) or Marburg (MBG) virus do not become ill. A suckling-mouse-passaged variant of EBO Zaire '76 ('mouse-adapted EBO-Z') causes rapidly lethal infection in adult mice after intraperitoneal (i.p.) inoculation, but does not cause apparent disease when inoculated subcutaneously (s.c.). A series of experiments showed that both forms of resistance to infection are mediated by the Type I interferon response. Mice lacking the cell-surface IFN-alpha/beta receptor died within a week after inoculation of EBO-Z '76, EBO Sudan, MBG Musoke or MBG Ravn, or after s.c. challenge with mouse-adapted EBO-Z. EBO Reston and EBO Ivory Coast did not cause illness, but immunized the mice against subsequent challenge with mouse-adapted EBO-Z. Normal adult mice treated with antibodies against murine IFN-alpha/beta could also be lethally infected with i.p.-inoculated EBO-Z '76 or EBO Sudan and with s.c.-inoculated mouse-adapted EBO-Z. Severe combined immunodeficient (SCID) mice became ill 3-4 weeks after inoculation with EBO-Z '76, EBO Sudan or MBG Ravn, but not the other viruses. Treatment with anti-IFN-alpha/beta antibodies markedly accelerated the course of EBO-Z '76 infection. Antibody treatment blocked the effect of a potent antiviral drug, 3-deazaneplanocin A, indicating that successful filovirus therapy may require the active participation of the Type I IFN response. Mice lacking an IFN-alpha/beta response resemble primates in their susceptibility to rapidly progressive, overwhelming filovirus infection. The outcome of filovirus transfer between animal species appears to be determined by interactions between the virus and the innate immune response. ",,,"Bray, M ",,,,,,,,,,,,,,,,Jun ,,,,,,23/05/2001,12527,Pt 6 ,,The Journal of general virology ,,,,"Adenosine/analogs & derivatives/therapeutic use  , Suckling/immunology/virology Antibodies/immunology Antiviral Agents/therapeutic use DNA-Binding Proteins/genetics/metabolism Disease Susceptibility/immunology Filoviridae/immunology/pathogenicity Filoviridae Infections/drug therapy/immunology/virology Gene Deletion Immunization Injections, Intraperitoneal Injections, Subcutaneous Interferon Type I/genetics/immunology Membrane Proteins Mice Mice, Inbred BALB C Mice, Inbred Strains Mice, Knockout Mice, SCID Receptor, Interferon alpha-beta Receptors, Interferon/genetics/immunology/metabolism STAT1 Transcription Factor Species Specificity Survival Rate Trans-Activators/genetics/metabolism Virulence/genetics Weight Loss ",,,,,,,,,,,,,,,,,2001,,,,,0022-1317 (Print) 0022-1317 ,1365-73 ,The role of the Type I interferon response in the resistance of mice to filovirus infection ,,J Gen Virol ,,,The role of the Type I interferon response in the resistance of mice to filovirus infection ,,,,,,,,82,,,,  
