JOUR ,,,,,"PURPOSE: VCAM-1 plays a major role in the chronic inflammatory processes present in vulnerable atherosclerotic plaques. The residues 75-84 (B2702-p) and 84-75/75-84 (B2702-rp) of the major histocompatibility complex-1 (MHC-1) molecule B2702 were previously shown to bind specifically to VCAM-1. We hypothesised that radiolabelled B2702-p and B2702-rp might have potential for the molecular imaging of vascular cell adhesion molecule-1 (VCAM-1) expression in atherosclerotic plaques. METHODS: Preliminary biodistribution studies indicated that 125I-B2702-rp was unsuitable for in vivo imaging owing to extremely high lung uptake. 123I- or 99mTc-labelled B2702-p was injected intravenously to Watanabe heritable hyperlipidaemic rabbits (WHHL, n=6) and control animals (n=6). After 180 min, aortas were harvested for ex vivo autoradiographic imaging, gamma-well counting, VCAM-1 immunohistology and Sudan IV lipid staining. RESULTS: Robust VCAM-1 immunostaining was observed in Sudan IV-positive and to a lesser extent in Sudan IV-negative areas of WHHL animals, whereas no expression was detected in control animals. Significant 2.9-fold and 1.9-fold increases in 123I-B2702-p and 99mTc-B2702-p aortic-to-blood ratios, respectively, were observed between WHHL and control animals (p<0.05). Tracer uptake on ex vivo images co-localised with atherosclerotic plaques. Image quantification indicated a graded increase in 123I-B2702-p and 99mTc-B2702-p activities from control to Sudan IV-negative and to Sudan IV-positive areas, consistent with the observed pattern of VCAM-1 expression. Sudan IV-positive to control area tracer activity ratios were 17.0+/-9.0 and 5.9+/-1.8 for 123I-B2702-p and 99mTc-B2702-p, respectively. CONCLUSION: Radiolabelled B2702-p is a potentially useful radiotracer for the molecular imaging of VCAM-1 in atherosclerosis. ",,,"Ghezzi, C ",,,,,,,,,,,,,,,,Jun ,,,,,,16/01/2007,12543,6,,"European journal of nuclear medicine and molecular imaging KW  -, Immunologic/pharmacology  Aorta/metabolism/radionuclide imaging Atherosclerosis/pathology/radionuclide imaging Autoradiography/methods Azo Compounds/pharmacology Diagnostic Imaging/methods Disease Models, Animal Dose-Response Relationship, Drug Inflammation Iodine Radioisotopes/therapeutic use Major Histocompatibility Complex Peptide Fragments/pharmacology Rabbits Vascular Cell Adhesion Molecule-1/biosynthesis ",,,,,,,,,,,,,,,,,,,,,2007,,,,,1619-7070 (Print) 1619-7070 ,830-40 ,Molecular imaging of vascular cell adhesion molecule-1 expression in experimental atherosclerotic plaques with radiolabelled B2702-p ,,Eur J Nucl Med Mol Imaging ,,,Molecular imaging of vascular cell adhesion molecule-1 expression in experimental atherosclerotic plaques with radiolabelled B2702-p ,,,,,,,,34,,,,  
JOUR ,,,,,"PURPOSE: VCAM-1 plays a major role in the chronic inflammatory processes present in vulnerable atherosclerotic plaques. The residues 75-84 (B2702-p) and 84-75/75-84 (B2702-rp) of the major histocompatibility complex-1 (MHC-1) molecule B2702 were previously shown to bind specifically to VCAM-1. We hypothesised that radiolabelled B2702-p and B2702-rp might have potential for the molecular imaging of vascular cell adhesion molecule-1 (VCAM-1) expression in atherosclerotic plaques. METHODS: Preliminary biodistribution studies indicated that 125I-B2702-rp was unsuitable for in vivo imaging owing to extremely high lung uptake. 123I- or 99mTc-labelled B2702-p was injected intravenously to Watanabe heritable hyperlipidaemic rabbits (WHHL, n=6) and control animals (n=6). After 180 min, aortas were harvested for ex vivo autoradiographic imaging, gamma-well counting, VCAM-1 immunohistology and Sudan IV lipid staining. RESULTS: Robust VCAM-1 immunostaining was observed in Sudan IV-positive and to a lesser extent in Sudan IV-negative areas of WHHL animals, whereas no expression was detected in control animals. Significant 2.9-fold and 1.9-fold increases in 123I-B2702-p and 99mTc-B2702-p aortic-to-blood ratios, respectively, were observed between WHHL and control animals (p<0.05). Tracer uptake on ex vivo images co-localised with atherosclerotic plaques. Image quantification indicated a graded increase in 123I-B2702-p and 99mTc-B2702-p activities from control to Sudan IV-negative and to Sudan IV-positive areas, consistent with the observed pattern of VCAM-1 expression. Sudan IV-positive to control area tracer activity ratios were 17.0+/-9.0 and 5.9+/-1.8 for 123I-B2702-p and 99mTc-B2702-p, respectively. CONCLUSION: Radiolabelled B2702-p is a potentially useful radiotracer for the molecular imaging of VCAM-1 in atherosclerosis. ",,,"Ghezzi, C. ",,,,,,,,,,,,,,,,Jun ,,,,,,,19407,6,,,,,,"Adjuvants, Immunologic/pharmacology Animals Aorta/diagnostic imaging/metabolism Atherosclerosis/diagnostic imaging/pathology Autoradiography/methods Azo Compounds/pharmacology Diagnostic Imaging/methods Disease Models, Animal Dose-Response Relationship, Drug Inflammation Iodine Radioisotopes/therapeutic use Major Histocompatibility Complex Peptide Fragments/pharmacology Rabbits Radionuclide Imaging Vascular Cell Adhesion Molecule-1/biosynthesis ",,,,,,,,,,,"Broisat, A Riou, L M Ardisson, V Boturyn, D Dumy, P Fagret, D Ghezzi, C eng Research Support, Non-U.S. Gov't Germany 2007/01/16 09:00 Eur J Nucl Med Mol Imaging. 2007 Jun;34(6):830-40. Epub 2007 Jan 12. ",,,,,,2007,,,,,1619-7070 (Print) 1619-7070 (Linking) ,830-40 ,Molecular imaging of vascular cell adhesion molecule-1 expression in experimental atherosclerotic plaques with radiolabelled B2702-p ,,Eur J Nucl Med Mol Imaging ,,,Molecular imaging of vascular cell adhesion molecule-1 expression in experimental atherosclerotic plaques with radiolabelled B2702-p ,,,,,,,https://www.ncbi.nlm.nih.gov/pubmed/17219135 ,34,,,,  
JOUR ,,,,,"We have developed a sensitive and specific method to identify Trypanosoma brucei gambiense using the polymerase chain reaction (PCR) to amplify the gene encoding variant surface glycoprotein (VSG) Antat 11.17. The test was capable of distinguishing T. b. gambiense from T. b. brucei in most foci of gambian sleeping sickness and gave positive results with previously well-characterised Type I T. b. gambiense stocks from Ivory Coast, Nigeria, Cameroon, Congo, Zaire and Sudan. The test gave negative results with T. b. rhodesiense from Zambia, Kenya and Uganda, virulent or Type II T. b. gambiense from Ivory Coast and T. b. brucei stocks from East and West Africa. The test was modified for colorimetric detection in dot blot format by using nested biotinylated primers in a two-step reaction. Comparison of DNA sequences of VSG genes from T. b. gambiense and other T. brucei ssp. stocks showed a high level of homology, suggesting recent gene flow. ",,,"Dukes, P ",,,,,,,,,,,,,,,,Apr ,,,,,,01/04/1993,12544,2,,Acta tropica ,,,," Base Sequence Genes, Protozoan  Molecular Sequence Data Polymerase Chain Reaction Sensitivity and Specificity Trypanosoma brucei gambiense/isolation & purification Variant Surface Glycoproteins, Trypanosoma/genetics ",,,,,,,,,,,,,,,,,1993,,,,,0001-706X (Print) 0001-706x ,107-19 ,Identification of Trypanosoma brucei gambiense by PCR amplification of variant surface glycoprotein genes ,,Acta Trop ,,,Identification of Trypanosoma brucei gambiense by PCR amplification of variant surface glycoprotein genes ,,,,,,,,53,,,,  
JOUR ,,,,,,,,"al, et ",,,,,,,,,,,,,,,,1952,,,,,,,599,,,,,,,Blood Groups ,,,,,,,,,,,,,,,,,1952,,,,,,,Blood groups ,,Anals of Eugenices ,,,Blood groups ,,,,,,,,17,,,,  
JOUR ,,,,,,,,"Rzoska, J ",,,,,,,,,,,,,,,,1954,,,,,,,600,,,,,,,Jebel Aulia Dam Nile Plankton ,,,,,,,,,,,,,,,,,1954,,,,,,101,The influence of Jebel Aulia dam on the development of Nile Plankton ,,J An Ecol ,,,The influence of Jebel Aulia dam on the development of Nile Plankton ,,,,,,,,23,,,,  
JOUR ,,,,,,,,"Guyatt, H ",,,,,,,,,,,,,,,,,,,,,,,6657,2,,,,,,,,,,,,,,,,,,,,,,,1999,,,,,0035-9203 ,125-126 ,Comparisons of schistosome and geohelminth infection prevalences in school-aged children from selected areas of Africa: implications for rapid assessment and combined control ,,Transactions of the Royal Society of Tropical Medicine and Hygiene ,,,Comparisons of schistosome and geohelminth infection prevalences in school-aged children from selected areas of Africa: implications for rapid assessment and combined control ,,,,,,,,93,,,,  
JOUR ,,,,,,,,"Brothwell, DR ",,,,,,,,,,,,,,,,1961,,,,,,,3283,,,,,,,Palaeopathology ,,,,,,,,,,,,,,,,,1961,,,,,,318-344 ,The Palaeopathology of Early British Man: an essay on the problems of diagnosis and analysis ,,J. Roy. Anthrop. Inst. ,,,The Palaeopathology of Early British Man: an essay on the problems of diagnosis and analysis ,,,,,,,,91,,,,  
JOUR ,,,,,,,,"al, et ",,,,,,,,,,,,,,,,1961,,,,,,,601,,,,,,,Insecticides Chironomid Midges Blue Nile ,,,,,,,,,,,,,,,,,1961,,,,,,789-801 ,Insecticidal operations against chironomid midges along the Blue Nile ,,Bull Ent Res ,,,Insecticidal operations against chironomid midges along the Blue Nile ,,,,,,,,4,,,,  
JOUR ,,,,,"Northeastern corner of Africa, lying at the crossroads between the two continents of Europe and Asia (in the Sinai Peninsula), while bordering Libya, Sudan, Israel and the Red Sea. Egypt is the most ancient tourist country in the world. Several health fact-finding missions in the last few years were made to this small country that is frequently defined by the Valley of the Nile. With the spreading deserts on either side, or a very rich heritage of ancient relics, these scenic vistas are without equal elsewhere in the world. Although there are significant cultural differences among the population, Egypt has a long history of ethnic and religious compassion. Among the many rarities, main tourist attractions include the three great Pyramids of Giza and the Sphinx, amazing ancient wonders of the world. These fact-finding missions included how health and medical care are defined, how people and culture are intertwined with its physical features, land use, and the economy and its resources. ",,,"Brown, G ",,,,,,,,,,,,,,,,Fall ,,,,,,26/11/2009,12546,4,,"The ABNF journal : official journal of the Association of Black Nursing Faculty in Higher Education, Inc ",,,,Cultural Characteristics Delivery of Health Care Egypt  Religion Travel ,,,,,,,,,,,,,,,,,2009,,,,,1046-7041 (Print) 1046-7041 ,112-4 ,"Eyewitness introduction to Egypt: ""The gift of the Nile"" ",,Abnf j ,,,"Eyewitness introduction to Egypt: ""The gift of the Nile"" ",,,,,,,,20,,,,  
JOUR ,,,,,,,,"Brown, H ",,,,,,,,,,,,,,,,Aug 21-27 ,,,,,,27/08/2004,12547,9435,,"Lancet (London, England) ",,,,Communicable Diseases/epidemiology  International Cooperation Refugees Relief Work/economics Starvation/epidemiology Sudan/epidemiology ,,,,,,,,,,,,,,,,,2004,,,,,0140-6736 ,654,Disease and hunger in Sudan ,,Lancet ,,,Disease and hunger in Sudan ,,,,,,,,364,,,,  
JOUR ,,,,,,,,"Brown, H ",,,,,,,,,,,,,,,,Feb-24,,,,,,28/02/2007,12548,9562,,"Lancet (London, England) ",,,,Altruism  Health Services Needs and Demand   Refugees Relief Work Security Measures/statistics & numerical data Sudan Violence ,,,,,,,,,,,,,,,,,2007,,,,,0140-6736 ,630-2 ,Worsening security in Darfur could reverse health gains ,,Lancet ,,,Worsening security in Darfur could reverse health gains ,,,,,,,,369,,,,  
JOUR ,,,,,,,,"Brown, Judith K ",,,,,,,,,,,,,,,,1963,,,,,,,3231,,,,,,,Traditional Sudanese Medicine Female Genital Cutting (Circumcision) Anthropology Medical Folklore Traditional Sudanese Medicine ,,,,,,,,,,,,,,,,,1963,,,,,,837-53 ,A Cross-Cultural Study of Female Initiation Rites ,,American Anthropologist ,,,A Cross-Cultural Study of Female Initiation Rites ,,,,,,,,65,,,,  
JOUR ,,,,,"Thirty-seven azo, xanthene and triphenylmethane dyes including FD and C colors currently approved for use in the U.S.A. and a number of delisted food colors, were tested in the Salmonella/microsome system. In addition to direct plate tests with five tester strains (TA1535, TA100, TA1537, TA1538, TA98), the azo dyes were also assayed after chemical reduction to their component amines. Also, a selected group of azo dyes was subjected to liquid tests (both aerobic with microsomes and anaerobic) and to plate tests involving initial 16 h anaerobic incubations to facilitate microbial reduction of the azo bond. None of the presently listed FD and C colors was mutagenic in any of the test modifications. Among formerly listed colors only Butter Yellow (p-dimethylaminoazobenzene), a recognized animal carcinogen, was mutagenic in the aerobic liquid test. Several other azo dyes were either directly mutagenic, viz. Acid Alizarin Yellow R and Alizarin Yellow GG; required microsomal activation, viz. Acid Alizarin Red B and Methyl Red; or required chemical reduction and microsomal activation, viz. Acid Alizarin Violet N and Sudan IV. Of the non-azo dyes tested only two xanthene dyes appeared to be mutagenic, viz. 9-(2-sulfophenyl)-6-hydroxy-3-isoxanthenone and its 2,4,5,7-tetrabromo derivative. ",,,"Brown, RJ ",,,,,,,,,,,,,,,,Jan ,,,,,,01/01/1978,12549,3,,Mutation research ,,,,"Azo Compounds/pharmacology Food Coloring Agents/pharmacology Genetic Techniques Microsomes, Liver/metabolism Mutagens Salmonella typhimurium/genetics Terphenyl Compounds/pharmacology Xanthenes/pharmacology ",,,,,,,,,,,,,,,,,1978,,,,,0027-5107 (Print) 0027-5107 ,249-71 ,"Mutagenicity testing of certified food colors and related azo, xanthene and triphenylmethane dyes with the Salmonella/microsome system ",,Mutat Res ,,,"Mutagenicity testing of certified food colors and related azo, xanthene and triphenylmethane dyes with the Salmonella/microsome system ",,,,,,,,56,,,,  
JOUR ,,,,,"Thirty-seven azo, xanthene and triphenylmethane dyes including FD and C colors currently approved for use in the U.S.A. and a number of delisted food colors, were tested in the Salmonella/microsome system. In addition to direct plate tests with five tester strains (TA1535, TA100, TA1537, TA1538, TA98), the azo dyes were also assayed after chemical reduction to their component amines. Also, a selected group of azo dyes was subjected to liquid tests (both aerobic with microsomes and anaerobic) and to plate tests involving initial 16 h anaerobic incubations to facilitate microbial reduction of the azo bond. None of the presently listed FD and C colors was mutagenic in any of the test modifications. Among formerly listed colors only Butter Yellow (p-dimethylaminoazobenzene), a recognized animal carcinogen, was mutagenic in the aerobic liquid test. Several other azo dyes were either directly mutagenic, viz. Acid Alizarin Yellow R and Alizarin Yellow GG; required microsomal activation, viz. Acid Alizarin Red B and Methyl Red; or required chemical reduction and microsomal activation, viz. Acid Alizarin Violet N and Sudan IV. Of the non-azo dyes tested only two xanthene dyes appeared to be mutagenic, viz. 9-(2-sulfophenyl)-6-hydroxy-3-isoxanthenone and its 2,4,5,7-tetrabromo derivative. ",,,"Brown, R. J. ",,,,,,,,,,,,,,,,Jan ,,,,,,,19412,3,,,,,,"Azo Compounds/pharmacology Food Coloring Agents/pharmacology Genetic Techniques Microsomes, Liver/metabolism Mutagens Salmonella typhimurium/genetics Terphenyl Compounds/pharmacology Xanthenes/pharmacology ",,,,,,,,,,,"Brown, J P Roehm, G W Brown, R J eng Netherlands 1978/01/01 Mutat Res. 1978 Jan;56(3):249-71. ",,,,,,1978,,,,,0027-5107 (Print) 0027-5107 (Linking) ,249-71 ,"Mutagenicity testing of certified food colors and related azo, xanthene and triphenylmethane dyes with the Salmonella/microsome system ",,Mutat Res ,,,"Mutagenicity testing of certified food colors and related azo, xanthene and triphenylmethane dyes with the Salmonella/microsome system ",,,,,,,https://www.ncbi.nlm.nih.gov/pubmed/342943 ,56,,,,  
JOUR ,,,,,,,,"Ren, J ",,,,,,,,,,,,,,,,,,,,,,,16322,4,,,,,,,,,,,,,,,,,,,,,,,1999,,,,,0145-5680 ,453-465 ,Acetaldehyde depresses myocardial contraction and cardiac myocyte shortening in spontaneously hypertensive rats: role of intracellular Ca2+ ,,"Cellular and molecular biology (Noisy-le-Grand, France) ",,,Acetaldehyde depresses myocardial contraction and cardiac myocyte shortening in spontaneously hypertensive rats: role of intracellular Ca2+ ,,,,,,,,45,,,,  
JOUR ,,,,,,,,"Lepec, Richard ",,,,,,,,,,,,,,,,2002,,,,,,,17369,9301,,,,,,,,,,,,,,,,,https://www.researchgate.net/profile/Richard_Lepec/publication/11550607_Violence_in_southern_Sudan/links/55561d8208ae6943a873375b.pdf ,,,,,,2002,,,,,,161,Violence in southern Sudan ,,The Lancet ,,,Violence in southern Sudan ,,,,,,,,359,,,,  
JOUR ,,,,,,,,"Lepec, R ",,,,,,,,,,,,,,,,Jan-12,,,,,,26/01/2002,12551,9301,,"Lancet (London, England) ",,,,"Age Distribution Child Child, Preschool     Mortality Population Surveillance Public Health Refugees/statistics & numerical data Retrospective Studies Sex Distribution Sudan/epidemiology Violence/statistics & numerical data/trends Warfare ",,,,,,,,,,,,,,,,,2002,,,,,0140-6736 (Print) 0140-6736 ,161,Violence in southern Sudan ,,Lancet ,,,Violence in southern Sudan ,,,,,,,,359,,,,  
BOOK ,,,,,,,,"Browne, EG ",,,,,,,,,,,,,,,"Cambridge, U.K. ",1921,,,,,,,4178,,,,,,,History of Medicine ,,,,,,,,,,,,,,,,,1921,,,,,,,Arabian Medicine ,,,,,Arabian Medicine ,,,,,,,,,,,,  
JOUR ,,,,,"In early April 2014, two South Sudanese refugees in the Gambella region of western Ethiopia experienced acute onset of jaundice, accompanied by fever. One patient was a pregnant woman aged 24 years evaluated at a routine prenatal clinic visit in Leitchour refugee camp. The second patient was a malnourished boy aged 1 year who resided in Tierkidi refugee camp. The boy died despite hospitalization. During the last 2 weeks of May, four more cases of acute jaundice syndrome (AJS), defined as yellow discoloration of the eyes, were detected in Leitchuor. By mid-June, an additional 50 AJS cases were reported across three large camps in the region, Kule, Leitchuor, and Tierkidi, with 45 (90%) of these cases reported in Leitchuor. Sera collected from a convenience sample of 21 AJS cases were sent to Addis Ababa and Nairobi for real-time polymerase chain reaction testing; 12 (57%) were positive for hepatitis E virus (HEV) RNA. By January 2015, a total of 1,117 suspected cases of hepatitis E meeting the case definition of AJS were reported among refugees in camps across Gambella. ",,,"Shahpar, C ",,,,,,,,,,,,,,,,May-22,,,,,,23/05/2015,12552,19,,MMWR. Morbidity and mortality weekly report ,,,,Disease Outbreaks Ethiopia/epidemiology  Hepatitis E/epidemiology    Pregnancy Refugees/statistics & numerical data Sudan/ethnology   ,,,,,,,,,,,,,,,,,2015,,,,,0149-2195 ,537,"Notes from the field: hepatitis E outbreak among refugees from South Sudan - Gambella, Ethiopia, April 2014-January 2015 ",,MMWR Morb Mortal Wkly Rep ,,,"Notes from the field: hepatitis E outbreak among refugees from South Sudan - Gambella, Ethiopia, April 2014-January 2015 ",,,,,,,,64,,,,  
JOUR ,,,,,"In early April 2014, two South Sudanese refugees in the Gambella region of western Ethiopia experienced acute onset of jaundice, accompanied by fever. One patient was a pregnant woman aged 24 years evaluated at a routine prenatal clinic visit in Leitchour refugee camp. The second patient was a malnourished boy aged 1 year who resided in Tierkidi refugee camp. The boy died despite hospitalization. During the last 2 weeks of May, four more cases of acute jaundice syndrome (AJS), defined as yellow discoloration of the eyes, were detected in Leitchuor. By mid-June, an additional 50 AJS cases were reported across three large camps in the region, Kule, Leitchuor, and Tierkidi, with 45 (90%) of these cases reported in Leitchuor. Sera collected from a convenience sample of 21 AJS cases were sent to Addis Ababa and Nairobi for real-time polymerase chain reaction testing; 12 (57%) were positive for hepatitis E virus (HEV) RNA. By January 2015, a total of 1,117 suspected cases of hepatitis E meeting the case definition of AJS were reported among refugees in camps across Gambella. ",,,Prevention ,,,,,,,,,,,,,,,,May-22,,,,,,,19414,19,,,,,,Disease Outbreaks Ethiopia/epidemiology Female Hepatitis E/epidemiology Humans Infant Male Pregnancy Refugees/statistics & numerical data Sudan/ethnology Young Adult ,,,,,,,,,,,"Browne, Lauren B Menkir, Zeray Kahi, Vincent Maina, Gidraf Asnakew, Solomon Tubman, Michelle Elyas, Hajir Z Nigatu, Alemayehu Dak, David Maung, U Aye Nakao, Jolene H Bilukha, Oleg Shahpar, Cyrus (CDC) eng 2015/05/23 06:00 MMWR Morb Mortal Wkly Rep. 2015 May 22;64(19):537. ",,,,,,2015,,,,,1545-861X (Electronic) 0149-2195 (Linking) ,537,"Notes from the field: hepatitis E outbreak among refugees from South Sudan - Gambella, Ethiopia, April 2014-January 2015 ",,MMWR Morb Mortal Wkly Rep ,,,"Notes from the field: hepatitis E outbreak among refugees from South Sudan - Gambella, Ethiopia, April 2014-January 2015 ",,,,,,,https://www.ncbi.nlm.nih.gov/pubmed/25996097 ,64,,,,  
JOUR ,,,,,"Three odontogenic cysts, two of dentigerous and one of dental type, are reported in which large numbers of cells containing autofluorescent granules were present, in both the capsule and cyst lining. Histochemical and electron microscopical studies suggest that the granules are composed of lipofuscin. Examination of 30 examples each of dental cysts, dentigerous cysts and odontogenic keratocysts indicated that the prevalence of occasional cells of similar appearance was about 40%, 50% and 17% respectively. The pathogenesis of these cells is discussed. ",,,"Rippin, JW ",,,,,,,,,,,,,,,,Nov ,,,,,,01/11/1984,12553,6,,Histopathology ,,,," Azo Compounds Dentigerous Cyst/pathology Fluorescence   Microscopy, Electron Middle Aged Naphthalenes Odontogenic Cysts/pathology ",,,,,,,,,,,,,,,,,1984,,,,,0309-0167 (Print) 0309-0167 ,937-45 ,Autofluorescent granular cells in odontogenic cysts ,,Histopathology ,,,Autofluorescent granular cells in odontogenic cysts ,,,,,,,,8,,,,  
JOUR ,,,,,"Three odontogenic cysts, two of dentigerous and one of dental type, are reported in which large numbers of cells containing autofluorescent granules were present, in both the capsule and cyst lining. Histochemical and electron microscopical studies suggest that the granules are composed of lipofuscin. Examination of 30 examples each of dental cysts, dentigerous cysts and odontogenic keratocysts indicated that the prevalence of occasional cells of similar appearance was about 40%, 50% and 17% respectively. The pathogenesis of these cells is discussed. ",,,"Rippin, J. W. ",,,,,,,,,,,,,,,,Nov ,,,,,,,19415,6,,,,,,"Adult Azo Compounds Dentigerous Cyst/pathology Fluorescence Humans Male Microscopy, Electron Middle Aged Naphthalenes Odontogenic Cysts/pathology ",,,,,,,,,,,"Browne, R M Rippin, J W eng Case Reports England 1984/11/01 Histopathology. 1984 Nov;8(6):937-45. ",,,,,,1984,,,,,0309-0167 (Print) 0309-0167 (Linking) ,937-45 ,Autofluorescent granular cells in odontogenic cysts ,,Histopathology ,,,Autofluorescent granular cells in odontogenic cysts ,,,,,,,https://www.ncbi.nlm.nih.gov/pubmed/6526390 ,8,,,,  
BOOK ,,,,,,,,"Browne, William George ",,,,,,,,,,,,,,,London ,1799,,,,,,,3285,,,,,,,"History of Medicine Missionaries, Travellers and Explorers Traditional Sudanese Medicine Female Genital Cutting (Circumcision) ",,,,,,,,,,,,,,,,,1799,,,,,,,"Travels in Africa, Egypt and Syria from the Year 1792 to 1798 ",,,,,"Travels in Africa, Egypt and Syria from the Year 1792 to 1798 ",,,,,,,,,,,,  
BOOK ,,"Clingan, JM ",,,,,,"Bruce, James ",,,,,,,,,,,,,,,London ,1873,,,,,,,2866,,,,,,,"History of Medicine Missionaries, Travellers and Explorers ",,,,,,,,,,,,,,,,,1873,,,,,,,"Travels in Abyssinia and Nubia, 1768-1773, to Discover the Source of the Nile ",,,,,"Travels in Abyssinia and Nubia, 1768-1773, to Discover the Source of the Nile ",,,,,,,,,,,,  
JOUR ,,,,,"Allelic diversity at the Plasmodium vivax merozoite surface protein-3alpha (PvMsp-3alpha) locus was investigated using a combined polymerase chain reaction/restriction fragment length polymorphism (PCR/RFLP) protocol. Symptomatic patient isolates from global geographic origins showed a high level of polymorphism at the nucleotide level. These samples were used to validate the sensitivity, specificity, and reproducibility of the PCR/RFLP method. It was then used to investigate PvMsp3alpha diversity in field samples from children living in a single village in a malaria-endemic region of Papua New Guinea, with the aim of assessing the usefulness of this locus as an epidemiologic marker of P. vivax infections. Eleven PvMsp-3alpha alleles were distinguishable in 16 samples with single infections, revealing extensive parasite polymorphism within this restricted area. Multiple infections were easily detected and accounted for 5 (23%) of 22 positive samples. Pairs of samples from individual children provided preliminary evidence for high turnover of P. vivax populations. ",,,"Day, KP ",,,,,,,,,,,,,,,,Oct ,,,,,,05/11/1999,12554,4,,The American journal of tropical medicine and hygiene ,,,,"  Antigens, Protozoan/analysis/genetics Antigens, Surface/analysis/genetics Biomarkers/blood Brazil/epidemiology Child Child, Preschool DNA Primers/chemistry DNA, Protozoan/chemistry/isolation & purification El Salvador/epidemiology Electrophoresis, Agar Gel Genetic Variation/genetics  India/epidemiology Malaria, Vivax/epidemiology/parasitology Papua New Guinea/epidemiology Parasitemia/epidemiology/parasitology Plasmodium vivax/genetics/isolation & purification Polymerase Chain Reaction Polymorphism, Restriction Fragment Length Protozoan Proteins/analysis/genetics Reproducibility of Results Sensitivity and Specificity Sri Lanka/epidemiology Sudan/epidemiology ",,,,,,,,,,,,,,,,,1999,,,,,0002-9637 (Print) 0002-9637 ,518-25 ,Polymorphism at the merozoite surface protein-3alpha locus of Plasmodium vivax: global and local diversity ,,Am J Trop Med Hyg ,,,Polymorphism at the merozoite surface protein-3alpha locus of Plasmodium vivax: global and local diversity ,,,,,,,,61,,,,  
