JOUR ,,,,,,,,"Murphy, FA ",,,,,,,,,,,,,,,,Nov-15,,,,,,06/12/2007,12528,,,The Journal of infectious diseases ,,,," Democratic Republic of the Congo/epidemiology Filoviridae/pathogenicity Filoviridae Infections/prevention & control Hemorrhagic Fever, Ebola/epidemiology/prevention & control  Marburg Virus Disease/epidemiology/prevention & control Research/trends Sudan/epidemiology ",,,,,,,,,,,,,,,,,2007,,,,,0022-1899 (Print) 0022-1899 ,S438-43 ,Filovirus research: knowledge expands to meet a growing threat ,,J Infect Dis ,,,Filovirus research: knowledge expands to meet a growing threat ,,,,,,,,196 Suppl 2 ,,,,  
JOUR ,,,,,,,,"Murphy, F. A. ",,,,,,,,,,,,,,,,Nov-15,,,,,,,19397,,,,,,,"Animals Democratic Republic of the Congo/epidemiology Filoviridae/pathogenicity Filoviridae Infections/prevention & control Hemorrhagic Fever, Ebola/epidemiology/prevention & control Humans Marburg Virus Disease/epidemiology/prevention & control Research/trends Sudan/epidemiology ",,,,,,,,,,,"Bray, Mike Murphy, Frederick A eng Research Support, N.I.H., Extramural Research Support, Non-U.S. Gov't 2007/12/06 09:00 J Infect Dis. 2007 Nov 15;196 Suppl 2:S438-43. ",,,,,,2007,,,,,0022-1899 (Print) 0022-1899 (Linking) ,S438-43 ,Filovirus research: knowledge expands to meet a growing threat ,,J Infect Dis ,,,Filovirus research: knowledge expands to meet a growing threat ,,,,,,,https://www.ncbi.nlm.nih.gov/pubmed/17940981 ,196 Suppl 2 ,,,,  
JOUR ,,,,,,,,"Bray, R. S. ",,,,,,,,,,,,,,,,Jan ,,,,,,01/01/1972,12529,1,,British medical bulletin ,,,," Anemia/complications  Antibodies Antimony/therapeutic use Carrier State Climate Disease Reservoirs Erythromycin Ethylsuccinate/therapeutic use  Immunoglobulin G India Insect Vectors Leishmania/isolation & purification Leishmaniasis/drug therapy/epidemiology/immunology Leishmaniasis, Visceral Mice Phlebotomus Serum Albumin Sudan ",,,,,,,,,,,,,,,,,1972,,,,,0007-1420 (Print) 0007-1420 ,39-43 ,Leishmaniasis in the Old World ,,Br Med Bull ,,,Leishmaniasis in the Old World ,,,,,,,,28,,,,  
JOUR ,,,,,,,,"Bray, W ",,,,,,,,,,,,,,,,1904,,,,,,,598,,,,,,,Southern Sudan ,,,,,,,,,,,,,,,,,1904,,,,,,369,"The Southern Sudan, its climate and diseases ",,J Roy Army  Med Corps ,,,"The Southern Sudan, its climate and diseases ",,,,,,,,3,,,,  
JOUR ,,,,,"The relationship between lipid serum levels and coronary atherosclerotic plaque fat content was studied in 51 necropsy patients. Serum lipids were measured by standard techniques, during life, in the absence of lipid-lowering drugs. Intima, intimal fat and media areas were measured using a computerized system in cryosections of the odd segments of the right, anterior descending and circumflex coronary arteries stained with Sudan-IV. Mean intimal and lipid areas were 5.74 +/- 1.98 and 1.22 +/- 0.55 mm2 (22.12 +/- 8.48%) in 26 cases with high cholesterol (>or=200 mg/dL) and 4.98 +/- 1.94 and 1.16 +/- 0.66 mm2 (22.75 +/- 9.06%) in 25 cases with normal cholesterol (<200 mg/dL; P > 0.05). Patients with high levels of low-density lipoprotein (>or=130 mg/dL, N = 15) had a higher intima/media area ratio than those with normal levels of low-density lipoprotein (<130 mg/dL, N = 13, P < 0.01). No significant difference in the morphometrical variables was found in groups with high or low serum levels of triglycerides (>or=200 mg/dL, N = 13 vs <200 mg/dL, N = 36) or high-density lipoprotein (>or=35 mg/dL, N = 11 vs <35 mg/dL, N = 17). The association between the morphological measurements and serum levels of cholesterol, its fractions, and triglycerides was also tested and the correlation coefficients were low. Although high cholesterol is a risk factor, we show here that in patients with severe atherosclerosis blood cholesterol and triglyceride levels seem to have little influence on coronary lipid content, indicating that other factors may contribute to arterial lipid deposition and plaque formation. ",,,"da Luz, P. L. ",,,,,,,,,,,,,,,,Apr ,,,,,,03/04/2007,12530,4,,Brazilian journal of medical and biological research = Revista brasileira de pesquisas medicas e biologicas / Sociedade Brasileira de Biofisica ... [et al.] ,,,, Aged  Atherosclerosis/blood/pathology Coronary Vessels/chemistry/pathology   Lipids/blood  Middle Aged Risk Factors Severity of Illness Index ,,,,,,,,,,,,,,,,,2007,,,,,0100-879X (Print) 0100-879x ,467-73 ,Coronary fat content evaluated by morphometry in patients with severe atherosclerosis has no relation with serum lipid levels ,,Braz J Med Biol Res ,,,Coronary fat content evaluated by morphometry in patients with severe atherosclerosis has no relation with serum lipid levels ,,,,,,,,40,,,,  
JOUR ,,,,,"The relationship between lipid serum levels and coronary atherosclerotic plaque fat content was studied in 51 necropsy patients. Serum lipids were measured by standard techniques, during life, in the absence of lipid-lowering drugs. Intima, intimal fat and media areas were measured using a computerized system in cryosections of the odd segments of the right, anterior descending and circumflex coronary arteries stained with Sudan-IV. Mean intimal and lipid areas were 5.74 +/- 1.98 and 1.22 +/- 0.55 mm2 (22.12 +/- 8.48%) in 26 cases with high cholesterol (>or=200 mg/dL) and 4.98 +/- 1.94 and 1.16 +/- 0.66 mm2 (22.75 +/- 9.06%) in 25 cases with normal cholesterol (<200 mg/dL; P > 0.05). Patients with high levels of low-density lipoprotein (>or=130 mg/dL, N = 15) had a higher intima/media area ratio than those with normal levels of low-density lipoprotein (<130 mg/dL, N = 13, P < 0.01). No significant difference in the morphometrical variables was found in groups with high or low serum levels of triglycerides (>or=200 mg/dL, N = 13 vs <200 mg/dL, N = 36) or high-density lipoprotein (>or=35 mg/dL, N = 11 vs <35 mg/dL, N = 17). The association between the morphological measurements and serum levels of cholesterol, its fractions, and triglycerides was also tested and the correlation coefficients were low. Although high cholesterol is a risk factor, we show here that in patients with severe atherosclerosis blood cholesterol and triglyceride levels seem to have little influence on coronary lipid content, indicating that other factors may contribute to arterial lipid deposition and plaque formation. ",,,"da Luz, P. L. ",,,,,,,,,,,,,,,,Apr ,,,,,,,19399,4,,,,,,"Adult Aged Aged, 80 and over Atherosclerosis/blood/pathology Coronary Vessels/chemistry/pathology Female Humans Lipids/blood Male Middle Aged Risk Factors Severity of Illness Index ",,,,,,,,,,,"Braz, D J Jr Gutierrez, P S da Luz, P L eng Research Support, Non-U.S. Gov't Brazil 2007/04/03 09:00 Braz J Med Biol Res. 2007 Apr;40(4):467-73. ",,,,,,2007,,,,,0100-879X (Print) 0100-879X (Linking) ,467-73 ,Coronary fat content evaluated by morphometry in patients with severe atherosclerosis has no relation with serum lipid levels ,,Braz J Med Biol Res ,,,Coronary fat content evaluated by morphometry in patients with severe atherosclerosis has no relation with serum lipid levels ,,,,,,,https://www.ncbi.nlm.nih.gov/pubmed/17401489 ,40,,,,  
JOUR ,,,,,,,,"Bres, P ",,,,Pmc2395566 ,,,,,,,,,,,,,,,,,,01/01/1978,12533,2,,Bulletin of the World Health Organization ,,,,"Democratic Republic of the Congo Disease Outbreaks Hemorrhagic Fevers, Viral/epidemiology  International Cooperation Rhabdoviridae/isolation & purification Sudan ",,,,,,,,,,,,,,,,,1978,,,,,0042-9686 (Print) 0042-9686 ,245,"The epidemic of Ebola haemorrhagic fever in Sudan and Zaire, 1976: introductory note] ",,Bull World Health Organ ,,,"The epidemic of Ebola haemorrhagic fever in Sudan and Zaire, 1976: introductory note] ",,,,,,,,56,,,,  
JOUR ,,,,,,,,"Kotton, CN ",,,,,,,,,,,,,,,,Jul-27,,,,,,17/07/2013,12536,2,,Transplantation ,,,," Budd-Chiari Syndrome/immunology/surgery End Stage Liver Disease/immunology/surgery Hepatitis B, Chronic/immunology/surgery  Liver Transplantation  Parasitic Diseases/immunology Sudan/ethnology United States   ",,,,,,,,,,,,,,,,,2013,,,,,0041-1337 ,e7-9 ,"Two ""lost boys of Sudan"" undergo liver transplantation: infectious disease issues ",,Transplantation ,,,"Two ""lost boys of Sudan"" undergo liver transplantation: infectious disease issues ",,,,,,,,96,,,,  
JOUR ,,,,,,,,"Kotton, C. N. ",,,,,,,,,,,,,,,,Jul-27,,,,,,,19401,2,,,,,,"Adult Budd-Chiari Syndrome/immunology/surgery End Stage Liver Disease/immunology/surgery Hepatitis B, Chronic/immunology/surgery Humans Liver Transplantation Male Parasitic Diseases/immunology Sudan/ethnology United States Young Adult ",,,,,,,,,,,"Briant, Judith A Kotton, Camille N eng Case Reports Letter 2013/07/17 06:00 Transplantation. 2013 Jul 27;96(2):e7-9. doi: 10.1097/TP.0b013e318297ae0e. ",,,,,,2013,,,,,1534-6080 (Electronic) 0041-1337 (Linking) ,e7-9 ,"Two ""lost boys of Sudan"" undergo liver transplantation: infectious disease issues ",,Transplantation ,,,"Two ""lost boys of Sudan"" undergo liver transplantation: infectious disease issues ",,,,,,,https://www.ncbi.nlm.nih.gov/pubmed/23857005 ,96,,,,  
JOUR ,,,,,,,,"Bridel, Jacqueline ",,,,,,,,,,,,,,,,,,,,,,,16408,,,,,,,,,,,,,,,,,,,,,,,,2003,,,,,,,Study of Indigenous Plants and Non-Timber Products as Related to Traditional Medicine in the Nuba Mountains and Southern Blue Nile Region of South Sudan ,,"Washington: USAID-USDA PASA & International Agriculture Programs, University of Missouri ",,,Study of Indigenous Plants and Non-Timber Products as Related to Traditional Medicine in the Nuba Mountains and Southern Blue Nile Region of South Sudan ,,,,,,,,,,,,  
JOUR ,,,,,"Ngari virus is an orthobunyavirus recently recognized as a reassortant between Bunyamwera virus and an as yet unidentified M segment donor. Analysis of M segment sequences of Batai and Ilesha viruses revealed 95% deduced amino acid identity between Batai virus and Ngari virus. These findings suggest Batai virus as the donor of Ngari virus M segment sequence. Analysis of Batai virus-related African isolates identified UgMP-6830, isolated from mosquitoes in Uganda, as an isolate of Batai virus. KV-141, isolated during a febrile disease outbreak in Sudan, was identified as another isolate of Ngari virus, emphasizing a role of this reassortant virus in severe human illness throughout East Africa. ",,,"Lipkin, WI ",,,,Pmc1472162 ,,,,,,,,,,,,Jun ,,,,,,16/05/2006,12538,11,,Journal of virology ,,,,"/epidemiology Bunyamwera virus/genetics/isolation & purification Bunyaviridae Infections/complications/epidemiology/veterinary/virology Disease Outbreaks Fever/etiology Orthobunyavirus/classification/genetics/isolation & purification RNA, Viral/chemistry Reassortant Viruses/genetics/isolation & purification ",,,,,,,,,,,,,,,,,2006,,,,,0022-538X (Print) 0022-538x ,5627-30 ,Batai and Ngari viruses: M segment reassortment and association with severe febrile disease outbreaks in East Africa ,,J Virol ,,,Batai and Ngari viruses: M segment reassortment and association with severe febrile disease outbreaks in East Africa ,,,,,,,,80,,,,  
JOUR ,,,,,"Ngari virus is an orthobunyavirus recently recognized as a reassortant between Bunyamwera virus and an as yet unidentified M segment donor. Analysis of M segment sequences of Batai and Ilesha viruses revealed 95% deduced amino acid identity between Batai virus and Ngari virus. These findings suggest Batai virus as the donor of Ngari virus M segment sequence. Analysis of Batai virus-related African isolates identified UgMP-6830, isolated from mosquitoes in Uganda, as an isolate of Batai virus. KV-141, isolated during a febrile disease outbreak in Sudan, was identified as another isolate of Ngari virus, emphasizing a role of this reassortant virus in severe human illness throughout East Africa. ",,,"Lipkin, W. I. ",,,,PMC1472162 ,,,,,,,,,,,,Jun ,,,,,,,19402,11,,,,,,"Africa, Eastern/epidemiology Bunyamwera virus/genetics/isolation & purification Bunyaviridae Infections/complications/epidemiology/veterinary/virology Disease Outbreaks Fever/etiology Orthobunyavirus/classification/genetics/isolation & purification RNA, Viral/chemistry Reassortant Viruses/genetics/isolation & purification ",,,,,,,,,,,"Briese, Thomas Bird, Brian Kapoor, Vishal Nichol, Stuart T Lipkin, W Ian eng R21 AI056118/AI/NIAID NIH HHS/ AI 056118-02/AI/NIAID NIH HHS/ Research Support, N.I.H., Extramural Research Support, Non-U.S. Gov't 2006/05/16 09:00 J Virol. 2006 Jun;80(11):5627-30. ",,,,,,2006,,,,,0022-538X (Print) 0022-538X (Linking) ,5627-30 ,Batai and Ngari viruses: M segment reassortment and association with severe febrile disease outbreaks in East Africa ,,J Virol ,,,Batai and Ngari viruses: M segment reassortment and association with severe febrile disease outbreaks in East Africa ,,,,,,,https://www.ncbi.nlm.nih.gov/pubmed/16699043 ,80,,,,  
JOUR ,,,,,,,,"Nagasaka, T ",,,,,,,,,,,,,,,,Dec-14,,,,,,14/12/1990,12539,4987,,"Science (New York, N.Y.) ",,,,,,,,,,,,,,,,,,,,,1990,,,,,0036-8075 (Print) 0036-8075 ,1498,Imprisoned in Sudan ,,Science ,,,Imprisoned in Sudan ,,,,,,,,250,,,,  
JOUR ,,,,,,,,"Farid, N. M. ",,,,,,,,,,,,,,,,1987,,,,,,,115,,,,,,,,,,,,,,,,,,,,,,,,1987,,,,,,151,Use of anti-idiotypic antibodies as probes for the interactions of TSH sub units with its receptor ,,Cell Biochem ,,,Use of anti-idiotypic antibodies as probes for the interactions of TSH sub units with its receptor ,,,,,,,,34,,,,  
JOUR ,,,,,,,,"Farid, NR ",,,,,,,,,,,,,,,,1982,,,,,,,78,,,,,,,Hypergammaglobulinemia G with HLA-DR3 Graves' Disease ,,,,,,,,,,,,,,,,,1982,,,,,,20,Association of hypergammaglobulinemia G with HLA-DR3 in Graves' disease ,,Tissue Antigens ,,,Association of hypergammaglobulinemia G with HLA-DR3 in Graves' disease ,,,,,,,,19,,,,  
JOUR ,,,,,,,,"Brisset, Claire ",,,,,,,,,,,,,,,,"eb, March 1979 ",,,,,,,3456,,,,,,,Traditional Sudanese Medicine Female Genital Cutting (Circumcision) ,,,,,,,,,,,,,,,,,1979,,,,,,,On Female Circumcision ,,Le Monde ,,,On Female Circumcision ,,,,,,,,,,,,  
JOUR ,,,,,"PIP: The WHO organized in Sudan a conference on traditional practices affecting women's health, meaning such barbarous practices as excision, partial or total, of the clitoris, and infibulation. Such mutilations are still practiced in 25 African countries, notwithstanding official prohibition. Complications from such practices are several and severe, going from hemorrage to retention of urine, from serious lesions to infection and bad cicatrizations. Infertility and dysmenorrhea are long term complications, together with enormous, and often fatal, obstetrical difficulties at the time of delivery. eng ",,,"Brisset, C ",,,,,,,,,,,,,,,,Dec ,,,,,,01/12/1979,12540,12,,"Contraception, fertilite, sexualite ",,,," Biology Developing Countries Disease Economics Genitalia Genitalia,  Hemorrhage Infection Physiology Signs and Symptoms Socioeconomic Factors Urogenital System Women's Rights Bleeding Diseases Economic Factors Infections Urogenital Effects Urogenital System Women's Status ",,,,,fre ,,,,,,,,,Les mutilations sexuelles feminines. ,,,1979,,,,,0301-861X (Print) 0301-861x ,913-6 ,Sexual mutilation in women (author's transl)] ,,Contracept Fertil Sex (Paris) ,,,Sexual mutilation in women (author's transl)] ,,,,,,,,7,,,,  
JOUR ,,,,,,,,"Brock, Major RGC ",,,,,,,,,,,,,,,,1918,,,,,,,4621,,,,,,,Anthropology Medical Folklore Traditional Sudanese Medicine ,,,,,,,,,,,,,,,,,1918,,,,,,249-262 ,Some Notes on the Azande Tribe as Found in the Meridi District (Bahr Al-Ghazal Province) ,,Sudan Notes and Records ,,,Some Notes on the Azande Tribe as Found in the Meridi District (Bahr Al-Ghazal Province) ,,,,,,,,1,,,,  
CHAP ,,"Wortley, B A ",,,,,,"Brockington, Fraser ",,,,,,,,,,,,,,,Manchester ,,,,,,,,2328,,,,,,,,,,,,,,,,,,,,,,Manchester University Press ,,1957,,,,,,130-49 ,The World Health Organization (WHO) ,,The United Nations: The First Ten Tears ,,,The World Health Organization (WHO) ,,,,,,,,,,,,  
BOOK ,,,,,,,,Brockway ,,,,,,,,,,,,,,,,,,,,,,,3944,,,,,,,"History of Medicine Missionaries, Travellers and Explorers ",,,,,,,,,,,,,,,,,,,,,,,,African Journeys ,,,,,African Journeys ,,,,,,,,,,,,  
JOUR ,,,,,"Five nematode species were studied for ability to develop on seven summer cover crops in rotation with tomato transplants grown every third year. Increase of Tylenchorhynchus claytoni, Trichodorus christiei, Pratylenchus brachyurus, Helicotylenchus dihystera, and Xiphinema americanum in newly cleared soil varied with different cover crops. No substantial nematode population increases occurred until the third summer of crop growth. All species except X. americanum and H. dihystera developed best on sudangrass and millet. Crotalaria caused substantial increase of H. dihystera and P. brachyurus but suppressed the other species. Marigold suppressed all species except X. americanum which increased substantially on marigold during the 5th year. Cotton favored rapid increase of T. christiei, and moderate increases of all species except T. claytoni which was suppressed. Beggarweed favored moderate increases of T. christiei and H. dihystera but suppressed the other species. Hairy indigo favored rapid increase of H. dihystera, moderate increases of T. christiei and X. americanum, and suppressed the other species. Number of marketable transplants was reduced after 2 years of sudangrass and cotton; these crops favored increases of T. christiei and T. claytoni. The better cover crops prevented increases of most plant parasitic nematodes in land cropped to tomato, a suitable host. ",,,"Jaworski, CA ",,,,Pmc2618742 ,,,,,,,,,,,,Jul ,,,,,,01/07/1970,12541,3,,Journal of nematology ,,,,"Crotalaria spectabflis (crotalaria) Desmodium tortuosum (beggarweed) Gossypium hirsutum (cotton) Helicotylenchus dihystera Indigofera hirsuta (hairy indigo) Lycopersicon esculentum (tomato) Panicum ramosum (millet) Pratylenchus brachyurus Sorghum vulgare var. ""sudanense' (Sudan grass) Tagetes minuta (marigold) Trichodorus christiei Tylenchorhynchus claytoni Xiphinema americanum summer cover crops ",,,,,,,,,,,,,,,,,1970,,,,,0022-300X (Print) 0022-300x ,217-22 ,Population dynamics of plant nematodes in cultivated soil: effect of summer cover crops in newly cleared land ,,J Nematol ,,,Population dynamics of plant nematodes in cultivated soil: effect of summer cover crops in newly cleared land ,,,,,,,,2,,,,  
JOUR ,,,,,"Five nematode species were studied for ability to develop on seven summer cover crops in rotation with tomato transplants grown every third year. Increase of Tylenchorhynchus claytoni, Trichodorus christiei, Pratylenchus brachyurus, Helicotylenchus dihystera, and Xiphinema americanum in newly cleared soil varied with different cover crops. No substantial nematode population increases occurred until the third summer of crop growth. All species except X. americanum and H. dihystera developed best on sudangrass and millet. Crotalaria caused substantial increase of H. dihystera and P. brachyurus but suppressed the other species. Marigold suppressed all species except X. americanum which increased substantially on marigold during the 5th year. Cotton favored rapid increase of T. christiei, and moderate increases of all species except T. claytoni which was suppressed. Beggarweed favored moderate increases of T. christiei and H. dihystera but suppressed the other species. Hairy indigo favored rapid increase of H. dihystera, moderate increases of T. christiei and X. americanum, and suppressed the other species. Number of marketable transplants was reduced after 2 years of sudangrass and cotton; these crops favored increases of T. christiei and T. claytoni. The better cover crops prevented increases of most plant parasitic nematodes in land cropped to tomato, a suitable host. ",,,"Jaworski, C. A. ",,,,PMC2618742 ,,,,,,,,,,,,Jul ,,,,,,,19405,3,,,,,,"Crotalaria spectabflis (crotalaria) Desmodium tortuosum (beggarweed) Gossypium hirsutum (cotton) Helicotylenchus dihystera Indigofera hirsuta (hairy indigo) Lycopersicon esculentum (tomato) Panicum ramosum (millet) Pratylenchus brachyurus Sorghum vulgare var. ""sudanense' (Sudan grass) Tagetes minuta (marigold) Trichodorus christiei Tylenchorhynchus claytoni Xiphinema americanum summer cover crops ",,,,,,,,,,,"Brodie, B B Good, J M Jaworski, C A eng 1970/07/01 00:00 J Nematol. 1970 Jul;2(3):217-22. ",,,,,,1970,,,,,0022-300X (Print) 0022-300X (Linking) ,217-22 ,Population dynamics of plant nematodes in cultivated soil: effect of summer cover crops in newly cleared land ,,J Nematol ,,,Population dynamics of plant nematodes in cultivated soil: effect of summer cover crops in newly cleared land ,,,,,,,https://www.ncbi.nlm.nih.gov/pubmed/19322300 ,2,,,,  
JOUR ,,,,,,,,"Brodie, W ",,,,,,,,,,,,,,,,1973,,,,,,,2090,,,,,,,,,,,,,,,,,,,,,,,,1973,,,,,,,Personal  communication ,,,,,Personal  communication ,,,,,,,,,,,,  
JOUR ,,,,,"Centers for Disease Control guidelines for schistosomiasis and strongyloidiasis in Sudanese and Somali refugees are not widely implemented. Given limited prevalence data, we conducted a seroprevalence study of schistosomiasis, strongyloidiasis, and loiasis in Sudanese refugees across diverse ages. Sudanese refugees, ages 4-78, were recruited via community organizations. Half of the patients (86/172), were seropositive for schistosomiasis (46/171; 26.9%), strongyloidiasis (56/172; 33%), or both (16/171; 9.4%). No Loa loa infections were detected. Infection rates were similar in adults and children except that no schistosomiasis was detected in children < 4 years of age at the time of immigration to the United States. The high prevalence of schistosomiasis and strongyloidiasis in a community-based sample of Sudanese confirms the urgency for compliance with CDC refugee health guidelines. We detected no co-infection with Loa loa using the most sensitive serologic techniques, allowing use of ivermectin, the most effective treatment of strongyloidiasis. ",,,"Reed, SL ",,,,,,,,,,,,,,,,Mar ,,,,,,10/03/2009,12542,3,,The American journal of tropical medicine and hygiene ,,,,"  Aged Albendazole/economics/therapeutic use Anthelmintics/economics/therapeutic use Centers for Disease Control and Prevention (U.S.) Child Child, Preschool Cross-Sectional Studies  Helminthiasis/diagnosis/drug therapy/ethnology  Ivermectin/economics/therapeutic use  Middle Aged Practice Guidelines as Topic Refugees Seroepidemiologic Studies Sudan/ethnology United States   ",,,,,,,,,,,,,,,,,2009,,,,,0002-9637 ,425-30 ,Community based parasitic screening and treatment of Sudanese refugees: application and assessment of Centers for Disease Control guidelines ,,Am J Trop Med Hyg ,,,Community based parasitic screening and treatment of Sudanese refugees: application and assessment of Centers for Disease Control guidelines ,,,,,,,,80,,,,  
JOUR ,,,,,"Centers for Disease Control guidelines for schistosomiasis and strongyloidiasis in Sudanese and Somali refugees are not widely implemented. Given limited prevalence data, we conducted a seroprevalence study of schistosomiasis, strongyloidiasis, and loiasis in Sudanese refugees across diverse ages. Sudanese refugees, ages 4-78, were recruited via community organizations. Half of the patients (86/172), were seropositive for schistosomiasis (46/171; 26.9%), strongyloidiasis (56/172; 33%), or both (16/171; 9.4%). No Loa loa infections were detected. Infection rates were similar in adults and children except that no schistosomiasis was detected in children < 4 years of age at the time of immigration to the United States. The high prevalence of schistosomiasis and strongyloidiasis in a community-based sample of Sudanese confirms the urgency for compliance with CDC refugee health guidelines. We detected no co-infection with Loa loa using the most sensitive serologic techniques, allowing use of ivermectin, the most effective treatment of strongyloidiasis. ",,,"Reed, S. L. ",,,,,,,,,,,,,,,,Mar ,,,,,,,19406,3,,,,,,"Adolescent Adult Aged Albendazole/economics/therapeutic use Anthelmintics/economics/therapeutic use Centers for Disease Control and Prevention (U.S.) Child Child, Preschool Cross-Sectional Studies Female Helminthiasis/diagnosis/drug therapy/ethnology Humans Ivermectin/economics/therapeutic use Male Middle Aged Practice Guidelines as Topic Refugees Seroepidemiologic Studies Sudan/ethnology United States Young Adult ",,,,,,,,,,,"Brodine, Stephanie K Thomas, Anne Huang, Robert Harbertson, Judith Mehta, Sanjay Leake, John Nutman, Thomas Moser, Kathleen Wolf, Jamie Ramanathan, Roshan Burbelo, Peter Nou, John Wilkins, Patricia Reed, Sharon L eng Intramural NIH HHS/ Research Support, N.I.H., Intramural Research Support, Non-U.S. Gov't 2009/03/10 09:00 Am J Trop Med Hyg. 2009 Mar;80(3):425-30. ",,,,,,2009,,,,,1476-1645 (Electronic) 0002-9637 (Linking) ,425-30 ,Community based parasitic screening and treatment of Sudanese refugees: application and assessment of Centers for Disease Control guidelines ,,Am J Trop Med Hyg ,,,Community based parasitic screening and treatment of Sudanese refugees: application and assessment of Centers for Disease Control guidelines ,,,,,,,https://www.ncbi.nlm.nih.gov/pubmed/19270293 ,80,,,,  
